<?xml version="1.0" encoding="UTF-8"?>
<csalud xmlns:xsi="http://www.w3.org/2001/XMLSchema-instance" xsi:noNamespaceSchemaLocation="csalud.xsd">
<medicos>
    <medico>
        <identificador>rt5ud</identificador>
        <nombre>Juan</nombre>
        <especialidad>Traumatología</especialidad>
        <sala>1</sala>
    </medico>
    <medico>
        <identificador>rt5ud</identificador>
        <nombre>Juan</nombre>
        <especialidad>Traumatología</especialidad>
        <sala>1</sala>
    </medico>
</medicos>
<pacientes>
    <paciente id="1">
        <DNI>12345678a</DNI>
        <nombre></nombre>
        <direccion>
        </direccion>
        <telefono>555-555-555</telefono>
        <telefono>999-444-333</telefono>
        <NUSS></NUSS>
        <fechaNacimiento></fechaNacimiento>
        <sexo>Hombre</sexo>
    </paciente>
    <paciente>
        <DNI>12345678a</DNI>
        <nombre></nombre>
        <direccion>
        </direccion>
        <telefono>555-555-555</telefono>
        <telefono>999-444-333</telefono>
        <NUSS></NUSS>
        <fechaNacimiento></fechaNacimiento>
        <sexo>Hombre</sexo>
    </paciente>
</pacientes>
<citas>
    <cita>
        <fecha></fecha>
        <identificador>r555t</identificador>
        <DNI>12345678A</DNI>
        <tratamiento></tratamiento>
    </cita>
    <cita>
        <fecha></fecha>
        <identificador>r555t</identificador>
        <DNI>12345678A</DNI>
        <tratamiento></tratamiento>
    </cita>
</citas>


</csalud>